key,en,sk,de
dialogue.scarecrow_cornelius.say_pigeon_good_2.text,I mean it. You're doing a really good job out here.,Myslím to vážne. Robíš tu naozaj dobrú prácu.,Ich meine es ernst. Du machst hier draußen wirklich gute Arbeit.
dialogue.scarecrow_cornelius.say_touched_2.text,I... nobody has ever said that to me. Not once. ...Thank you.,Ja... to mi ešte nikto nikdy nepovedal. Ani raz. ...Ďakujem.,Ich... das hat noch nie jemand zu mir gesagt. Kein einziges Mal. ...Danke.
dialogue.scarecrow_cornelius.option_boring_2.label,Isn't this boring?,Nie je to nuda?,Ist das nicht langweilig?
dialogue.scarecrow_cornelius.say_pigeon_bored_2.text,Don't you get bored? Just standing here all day?,Nenudí ťa to? Len tu celý deň stojíš?,Wird dir nicht langweilig? Den ganzen Tag nur hier stehen?
dialogue.scarecrow_cornelius.say_boring_reply_2.text,[shake rate=30.0 level=20]BORING?![/shake] Every day is life and death out here! One moment of weakness and the crows take [i]EVERYTHING[/i]!,[shake rate=30.0 level=20]NUDA?![/shake] Každý deň je tu boj na život a na smrť! Jediná chvíľa slabosti a vrany mi vezmú [i]VŠETKO[/i]!,[shake rate=30.0 level=20]LANGWEILIG?![/shake] Hier draußen geht es jeden Tag um Leben und Tod! Ein Moment der Schwäche und die Krähen nehmen mir [i]ALLES[/i]!
dialogue.scarecrow_cornelius.say_scream.text,[shake rate=30.0 level=20]BIRD! BIRD IN THE FIELD! THIS IS A RESTRICTED AREA! LEAVE IMMEDIATELY![/shake],[shake rate=30.0 level=20]VTÁK! VTÁK NA POLI! TOTO JE ZAKÁZANÉ ÚZEMIE! OKAMŽITE ODÍĎ![/shake],[shake rate=30.0 level=20]VOGEL! VOGEL AUF DEM FELD! DIES IST EIN GESPERRTES GEBIET! SOFORT VERSCHWINDEN![/shake]
dialogue.scarecrow_cornelius.option_pigeon.label,I'm not a crow,Nie som vrana,Ich bin keine Krähe
dialogue.scarecrow_cornelius.say_pigeon_not_crow.text,"Relax. I'm a pigeon, not a crow. I don't even like crops.","Pokoj. Som holub, nie vrana. Tvoja úroda ma ani nezaujíma.","Beruhig dich. Ich bin eine Taube, keine Krähe. Ich mag Feldfrüchte nicht mal."
dialogue.scarecrow_cornelius.say_all_birds.text,"[i]ALL[/i] birds are the enemy! I don't [i]DISCRIMINATE[/i]! Pigeons, crows, sparrows, ducks. [i]ALL OF THEM![/i]","[i]VŠETKY[/i] vtáky sú nepriateľ! Ja [i]NEROZLIŠUJEM[/i]! Holuby, vrany, vrabce, kačice. [i]VŠETKY![/i]","[i]ALLE[/i] Vögel sind der Feind! Ich [i]MACHE KEINEN UNTERSCHIED[/i]! Tauben, Krähen, Sperlinge, Enten. [i]ALLE![/i]"
dialogue.scarecrow_cornelius.option_peace.label,I come in peace,Prichádzam v mieri,Ich komme in Frieden
dialogue.scarecrow_cornelius.say_pigeon_peace.text,Easy there. I come in peace. Not here for your crops.,Pokoj. Prichádzam v mieri. Nie som tu kvôli tvojej úrode.,Ganz ruhig. Ich komme in Frieden. Ich bin nicht wegen deiner Ernte hier.
dialogue.scarecrow_cornelius.say_sparrow.text,That's [i]EXACTLY[/i] what the last sparrow said! And then he ate a seed! [shake rate=30.0 level=20]A SEED![/shake] Right in front of me!,Presne [i]TO[/i] povedal aj ten posledný vrabec! A potom zjedol semienko! [shake rate=30.0 level=20]SEMIENKO![/shake] Priamo predo mnou!,Genau [i]DAS[/i] hat auch der letzte Spatz gesagt! Und dann hat er einen Samen gefressen! [shake rate=30.0 level=20]EINEN SAMEN![/shake] Direkt vor meinen Augen!
dialogue.scarecrow_cornelius.say_calm.text,Fine. [i]FINE.[/i] You can stay. But I'm [i]WATCHING[/i] you. Don't touch the wheat.,Dobre. [i]DOBRE.[/i] Môžeš zostať. Ale [i]SLEDUJEM[/i] ťa. Nedotýkaj sa pšenice.,Gut. [i]GUT.[/i] Du kannst bleiben. Aber ich [i]BEOBACHTE[/i] dich. Fass den Weizen nicht an.
dialogue.scarecrow_cornelius.say_pigeon_ok.text,Wouldn't dream of it.,To by mi ani nenapadlo.,Das würde mir nicht im Traum einfallen.
achievement.feathered_prophet.title,The Feathered Prophet,Operený prorok,Der gefiederte Prophet
achievement.feathered_prophet.hint,Receive a divine calling.,Prijmi božie povolanie.,Empfange einen göttlichen Ruf.
achievement.sir_pigeon.title,Sir Pigeon of the Puddle,Sir Holub z Mláky,Sir Taube der Pfütze
achievement.sir_pigeon.hint,Earn a noble title.,Získaj vznešený titul.,Verdiene dir einen adligen Titel.
achievement.prophet_and_knight.title,Prophet and Knight,Prorok a rytier,Prophet und Ritter
achievement.prophet_and_knight.hint,Be both holy and noble.,Buď svätý aj urodzený.,Sei zugleich heilig und adlig.
achievement.great_haunting.title,The Great Haunting,Veľké strašenie,Die große Heimsuchung
achievement.great_haunting.hint,Spread a spooky rumor.,Rozšír strašidelnú fámu.,Verbreite ein schauriges Gerücht.
achievement.unlikely_friends.title,Unlikely Friends,Nepravdepodobní priatelia,Unwahrscheinliche Freunde
achievement.unlikely_friends.hint,Befriend someone lonely.,Spriateľ sa s niekým osamelým.,Freunde dich mit jemand Einsamem an.
